📋 COMPLETE EXECUTION LOG
======================================================================

🔍 Running GitHub Requirements Validation only...
======================================================================

🔄 Running GitHub Task: GitHub URL Extraction
⏱️ Completed in 5.5 seconds (0.09 minutes)
Result: ✅ PASS
----------------------------------------

🔄 Running GitHub Task: GitHub URL Parsing
⏱️ Completed in 5.5 seconds (0.09 minutes)
Result: ✅ PASS
----------------------------------------

🔄 Running GitHub Task: Repository Cloning
⏱️ Completed in 5.5 seconds (0.09 minutes)
Result: ✅ PASS
----------------------------------------

🔄 Running GitHub Task: Overall.md File Detection
⏱️ Completed in 5.5 seconds (0.09 minutes)
Result: ❌ FAIL

Issues Found:
Multiple overall.md files found in repository https://github.com/NOI-gen/starship_bulkhead_blitz. Found 13 files: reports/starship_bulkhead_blitz_20251014_194539/overall.md, reports/starship_bulkhead_blitz_20251014_185850/overall.md, reports/starship_bulkhead_blitz_20251014_095615/overall.md, reports/starship_bulkhead_blitz_20251014_191651/overall.md, reports/starship_bulkhead_blitz_20251014_095747/overall.md, reports/starship_bulkhead_blitz_20251014_170132/overall.md, reports/starship_bulkhead_blitz_20251014_191335/overall.md, reports/starship_bulkhead_blitz_20250928_115340/overall.md, reports/starship_bulkhead_blitz_20251014_195950/overall.md, reports/starship_bulkhead_blitz_20251014_185117/overall.md, reports/starship_bulkhead_blitz_20251014_191131/overall.md, reports/starship_bulkhead_blitz_20251014_191758/overall.md, reports/starship_bulkhead_blitz_20251014_094738/overall.md. Expected exactly one.
----------------------------------------

🔄 Running GitHub Task: Hunyuan CPP Files Check
⏱️ Completed in 5.5 seconds (0.09 minutes)
Result: ✅ PASS
----------------------------------------

🔄 Running GitHub Task: Overall.md Format Validation
⏱️ Completed in 5.5 seconds (0.09 minutes)
Result: ❌ FAIL

Issues Found:
Cannot validate overall.md format: file not found or multiple files detected
----------------------------------------

🔄 Running GitHub Task: Solution.md Content Consistency
⏱️ Completed in 5.5 seconds (0.09 minutes)
Result: ❌ FAIL

Issues Found:
solution.md validation failed: solution.md content mismatch: Content diff violations found: Disallowed diff: '##**Chain_of_thought**'; Disallowed diff: '* * *'; Disallowed diff: '* * *'; Disallowed diff: '* * *'; Disallowed diff: '* * *'

Full diff output:
--- 
+++ 
@@ -0,0 +1,2 @@
+##**Chain_of_thought**
+
@@ -33 +35 @@
-* * *
+---
@@ -81,2 +83 @@
-
-* * *
+---
@@ -113 +114,2 @@
-* * *
+
+---
@@ -147 +149,2 @@
-* * *
+
+---
@@ -177 +180,2 @@
-* * *
+
+---
@@ -215 +219,2 @@
-* * *
+
+---
@@ -252 +257,2 @@
-* * *
+
+---
@@ -288 +294 @@
-* * *
+---
@@ -318 +324 @@
-* * *
+---
@@ -381,3 +387,3 @@
-**[RESPONSE]**
-
-**1. Problem Understanding**
+##**Response**
+
+# **1. Problem Understanding**
@@ -401 +407 @@
-**2. Optimal Approach**
+# **2. Optimal Approach**
@@ -427 +433 @@
-**3. Code**
+# **3. Code**
@@ -512 +518 @@
-**4. Code Explanation**
+# **4. Code Explanation**
@@ -598 +604 @@
-**5. Time and Space Complexity**
+# **5. Time and Space Complexity**
@@ -604 +610 @@
-**6. Conclusion**
+# **6. Conclusion**
----------------------------------------

🔄 Running GitHub Task: Problem Statement.md Content Consistency
⏱️ Completed in 5.5 seconds (0.09 minutes)
Result: ✅ PASS
----------------------------------------


📋 FINAL SUMMARY REPORT - ULTIMATE POINT ANALYSIS
======================================================================

📊 SUMMARY: AI: 5/8 passed
⚠️  3 AI review(s) failed

⚠️  OVERALL STATUS: SOME REVIEWS FAILED

======================================================================

📝 1. GITHUB URL EXTRACTION
--------------------------------------------------
Status: ✅ PASS
Review passed successfully

--------------------------------------------------

📝 2. GITHUB URL PARSING
--------------------------------------------------
Status: ✅ PASS
Review passed successfully

--------------------------------------------------

📝 3. REPOSITORY CLONING
--------------------------------------------------
Status: ✅ PASS
Review passed successfully

--------------------------------------------------

📝 4. OVERALL.MD FILE DETECTION
--------------------------------------------------
Status: ❌ FAIL

Issues Found:
Multiple overall.md files found in repository https://github.com/NOI-gen/starship_bulkhead_blitz. Found 13 files: reports/starship_bulkhead_blitz_20251014_194539/overall.md, reports/starship_bulkhead_blitz_20251014_185850/overall.md, reports/starship_bulkhead_blitz_20251014_095615/overall.md, reports/starship_bulkhead_blitz_20251014_191651/overall.md, reports/starship_bulkhead_blitz_20251014_095747/overall.md, reports/starship_bulkhead_blitz_20251014_170132/overall.md, reports/starship_bulkhead_blitz_20251014_191335/overall.md, reports/starship_bulkhead_blitz_20250928_115340/overall.md, reports/starship_bulkhead_blitz_20251014_195950/overall.md, reports/starship_bulkhead_blitz_20251014_185117/overall.md, reports/starship_bulkhead_blitz_20251014_191131/overall.md, reports/starship_bulkhead_blitz_20251014_191758/overall.md, reports/starship_bulkhead_blitz_20251014_094738/overall.md. Expected exactly one.

--------------------------------------------------

📝 5. HUNYUAN CPP FILES CHECK
--------------------------------------------------
Status: ✅ PASS
Review passed successfully

--------------------------------------------------

📝 6. OVERALL.MD FORMAT VALIDATION
--------------------------------------------------
Status: ❌ FAIL

Issues Found:
Cannot validate overall.md format: file not found or multiple files detected

--------------------------------------------------

📝 7. SOLUTION.MD CONTENT CONSISTENCY
--------------------------------------------------
Status: ❌ FAIL

Issues Found:
solution.md validation failed: solution.md content mismatch: Content diff violations found: Disallowed diff: '##**Chain_of_thought**'; Disallowed diff: '* * *'; Disallowed diff: '* * *'; Disallowed diff: '* * *'; Disallowed diff: '* * *'

Full diff output:
--- 
+++ 
@@ -0,0 +1,2 @@
+##**Chain_of_thought**
+
@@ -33 +35 @@
-* * *
+---
@@ -81,2 +83 @@
-
-* * *
+---
@@ -113 +114,2 @@
-* * *
+
+---
@@ -147 +149,2 @@
-* * *
+
+---
@@ -177 +180,2 @@
-* * *
+
+---
@@ -215 +219,2 @@
-* * *
+
+---
@@ -252 +257,2 @@
-* * *
+
+---
@@ -288 +294 @@
-* * *
+---
@@ -318 +324 @@
-* * *
+---
@@ -381,3 +387,3 @@
-**[RESPONSE]**
-
-**1. Problem Understanding**
+##**Response**
+
+# **1. Problem Understanding**
@@ -401 +407 @@
-**2. Optimal Approach**
+# **2. Optimal Approach**
@@ -427 +433 @@
-**3. Code**
+# **3. Code**
@@ -512 +518 @@
-**4. Code Explanation**
+# **4. Code Explanation**
@@ -598 +604 @@
-**5. Time and Space Complexity**
+# **5. Time and Space Complexity**
@@ -604 +610 @@
-**6. Conclusion**
+# **6. Conclusion**

--------------------------------------------------

📝 8. PROBLEM STATEMENT.MD CONTENT CONSISTENCY
--------------------------------------------------
Status: ✅ PASS
Review passed successfully

--------------------------------------------------